,Question,Option A,Option B,Option C,Option D,Correct Answer
1,The method for solving simultaneous linear equations known as Gaussian elimination was first documented in which ancient text?,Euclid's Elements,Chapter Eight: Rectangular Arrays of The Nine Chapters on the Mathematical Art,Al-Khwarizmi's The Compendious Book on Calculation by Completion and Balancing,The Rhind Mathematical Papyrus,b
2,Who introduced the term 'matrix'?,Arthur Cayley,Hermann Grassmann,James Joseph Sylvester,Benjamin Peirce,c
3,In what context was the method of elimination initially listed as an advancement?,Astronomy,Physics,Geodesy,Chemistry,c
4,"Who introduced matrix multiplication and the inverse matrix, enabling the general linear group?",W.R. Hamilton,Arthur Cayley,Benjamin Peirce,James Clerk Maxwell,b
5,"According to the text, what development significantly boosted research in efficient algorithms for Gaussian elimination and matrix decompositions?",The invention of the telegraph,The rise of Cartesian geometry,The development of computers,The discovery of quaternions,c
